{
  "assumed_profile" : "Coureur régulier capable de courir 5 km en 30-35 min sans difficulté, pratique 2×/semaine depuis au moins 2 mois. Aucune blessure active. Équipé de chaussures de running en bon état (< 600 km). Accès à une route ou piste plate pour les séances tempo et intervalles. Montre GPS ou application de suivi de distance recommandée.",
  "default_objective" : "Courir 10 km en continu (objectif de temps libre, typiquement 55-70 min selon allure individuelle)",
  "duration_weeks" : 8,
  "id" : "running-intermediaire-10k-8sem",
  "level" : "intermediaire",
  "name" : "10K — 8 semaines pour franchir la barre des 10 km",
  "progression_logic" : "Progression sur 5 principes alignés sur les recommandations ACSM, NSCA et les méthodologies Hal Higdon / Jack Daniels Running Formula :\n\n(1) STRUCTURE TRIPARTITE DE SÉANCE : chaque semaine contient 1 séance intervalles VO2max (400-800 m à allure 5K, RPE 8-9/10) + 1 séance tempo/seuil (20-32 min continus à allure 5K + 30-45 s/km, RPE 7/10) + 1 long run (allure facile = allure 5K + 90-120 s/km, RPE 5-6/10). Conformément aux guidelines ACSM pour la préparation intermédiaire 10K : les deux types d'intensité (seuil + VO2max) sont obligatoires et complémentaires — le tempo développe l'économie de course, les intervalles développent la puissance aérobie maximale.\n\n(2) RÈGLE 10-20% SUR LE LONG RUN : Long run : 6 → 7 → 8 → 9 → 7 (cutback) → 10 → 11 → 12 km. Progression km : +17% / +14% / +12% / -22% cutback / +43% retour / +10% / +9%. Les semaines post-cutback permettent un rebond plus marqué. Le long run de 12 km en W8 J1 respecte la règle 'distance cible × 120%' recommandée par Hal Higdon pour les plans 10K.\n\n(3) CUTBACK WEEK EN W5 : volume total réduit d'environ 15% par rapport à W4. Intervalles : 5×400 m au lieu de 3×800 m. Tempo : 20 min au lieu de 28 min. Long run : 7 km au lieu de 9 km. Renforcement réduit à 2 séries. Les adaptations tendineuses et osseuses (remodelage osseux tibial, adaptation tendons d'Achille et rotulien) se consolident pendant les phases de décharge.\n\n(4) RENFORCEMENT PRÉVENTIF INTERMÉDIAIRE : nordic curl assisté dès W1 (prévention tendinite ischio-jambière sur fractionné), single-leg squat dès W2 (prévention PFPS et équilibre G/D), calf raises excentriques dès W1 (prévention tendinopathie achilléenne — protocole excentrique validé, Alfredson 1998), clamshells tout au long du plan (prévention ITBS). Le renforcement est en fin de session (jamais avant), pour ne pas compromettre la qualité de course. Nordic curls et single-leg squats : repos 75-90 sec (NSCA : effort excentrique exigeant = récupération longue).\n\n(5) TAPERING W8 : J1 long run 12 km à allure très facile (stock glycogène + rappel distance), J3 activation courte 15 min + strides à allure cible (mémoire neuromusculaire de l'allure cible), J5 séance phare 10 km à allure cible. Le tapering de 5-7 jours pour un plan 10K est aligné sur les recommandations de la littérature (Mujika & Padilla, 2003 : réduction volume 40-60%, maintien intensité). Les allures cibles sont dérivées du test 5K de W1 (système Jack Daniels VDOT adapté) et doivent être recalculées par le système si l'utilisateur fournit son temps réel.",
  "safety_notes" : "DRAPEAUX ROUGES (arrêter immédiatement et consulter un médecin ou kiné si persistant > 5 jours) :\n• Douleur face postérieure de la cuisse pendant ou après les intervalles (tendinopathie ou déchirure ischio-jambière) : risque n°1 du coureur intermédiaire qui augmente le volume fractionné. Stopper le fractionné, ne jamais courir sur une douleur aiguë à l'ischio. Nordic curls préventifs intégrés au plan dès W1.\n• Douleur face interne du tibia ou os tibial à la palpation (périostite tibiale / stress fracture précoce) : arrêt total de la course, consultation médicale. La périostite tibiale évolue en fracture de fatigue si ignorée. Ne pas 'courir au-dessus de la douleur'.\n• Douleur face externe du genou, surtout en descente ou km 4-7 d'une longue sortie (ITBS / syndrome de l'essuie-glace) : les clamshells du plan sont préventifs. Si douleur installée : réduire volume 40%, glacer 15 min post-effort, avis kiné sous 1 semaine.\n• Douleur antérieure du genou lors des descentes ou après position assise prolongée (syndrome fémoro-patellaire / PFPS / genou du coureur) : single-leg squats préventifs intégrés. Si douleur > 3/10 : arrêter les intervalles, consulter.\n• Douleur derrière le talon ou tendineuse matinale raide (tendinopathie achilléenne) : les calf raises excentriques sont thérapeutiques et préventifs. Douleur aiguë = arrêt total de la course.\n• Douleur sous le talon ou arche plantaire au réveil (fasciite plantaire) : vérifier usure des chaussures (< 600 km), étirer mollets et fascia matin et soir.\n• Symptômes cardiaques (douleur thoracique, essoufflement disproportionné, palpitations irrégulières) : arrêt immédiat, avis médical avant reprise.\n\nRÈGLES GÉNÉRALES :\n• Chaussures de running en bon état (< 600 km, drop adapté à ta morphologie). Pour un coureur intermédiaire augmentant significativement le volume, un drop shift (ex : passer de 12 mm à 8 mm) doit être progressif sur plusieurs semaines, pas abrupt.\n• 48h minimum entre deux séances de même nature (ex : deux séances de fractionné). Le plan respecte ce principe : intervalles J1 / tempo J3 / long run J5.\n• Respecter les jours de repos (J2, J4, J6, J7). La surcompensation se produit pendant le repos, pas pendant l'effort.\n• Hydratation : 400-600 ml dans l'heure précédant toute séance > 40 min. Emporter eau pour long run > 7 km en conditions normales, > 5 km par temps chaud.\n• Nutrition long run : pour toute sortie > 60-70 min, planifier apport glucidique (30-60 g/heure : gel, dattes, banane). Tester son ravitaillement à l'entraînement, jamais en course.\n• Ne jamais introduire deux nouveautés simultanément (nouveau terrain + nouveau volume OU nouvelle chaussure + nouvelle intensité).\n\nINTENSITÉ :\n• Long run = allure conversationnelle complète. Tu dois pouvoir parler en phrases longues. Si tu ne peux pas, tu cours trop vite. L'erreur la plus fréquente de l'intermédiaire : courir les longs runs trop vite, ce qui compromet la récupération pour les séances de qualité.\n• Tempo/seuil : phrases courtes de 4-5 mots, RPE 7/10. Pas plus intense : au-delà du seuil, le bénéfice du tempo disparaît (tu passes en zone VO2max sans la récup qui va avec).\n• Intervalles VO2max : RPE 8-9/10 sur chaque 400-800 m. La première répétition ne doit pas être à fond : la régularité entre les répétitions compte plus que la vitesse pic.\n• Cadence cible : 170-180 pas/min sur toutes les allures. Une cadence basse (< 160) augmente les forces d'impact et le risque de blessure. Utiliser un métronome ou playlist 175 BPM si besoin.\n\nSIGNES DE SURCHARGE (3+ signes simultanés → réduire volume de 30% et prendre 2 jours de repos actif) :\n• FC de repos +8-10 bpm au-dessus de la normale au réveil 3 matins consécutifs\n• Courbatures persistantes > 72h après une séance habituelle\n• Perte d'allure inexpliquée sur des séances pourtant bien dosées\n• Sommeil dégradé (difficultés d'endormissement ou réveils nocturnes) > 3 nuits\n• Humeur irritable, motivation effondrée ou anxiété inhabituelle\n• Douleurs articulaires multiples simultanées\n\nSI SÉANCE MANQUÉE :\n• < 4 jours de pause : reprendre la séance suivante prévue (ne pas rattraper la séance manquée).\n• 4-7 jours de pause : reprendre à la semaine en cours, en commençant par la séance la plus facile.\n• 1-2 semaines de pause (maladie, voyage) : reprendre la semaine précédente.\n• > 2 semaines de pause : reprendre 2-3 semaines en arrière. Le déconditionnement VO2max commence à 10-14 jours d'inactivité totale.",
  "schema_version" : 1,
  "sessions_per_week" : 3,
  "sport" : "running",
  "summary" : "Plan 8 semaines pour coureur intermédiaire visant à doubler sa distance de référence (5K → 10K). Structure 3 séances/semaine : 1 sortie longue progressive (long run), 1 séance tempo/seuil (20-35 min à allure seuil), 1 séance interval/VO2max (400 m-1000 m à allure 5K). Renforcement préventif intégré (nordic curl, single-leg squat, calf raises excentriques) en sessions mixtes ou en préambule. Cutback week en W5 (volume -15%). Progression long run : 6 → 7 → 8 → 9 → 7 (cutback) → 10 → 11 → 12 km. Séance phare W8 = 10 km en continu à allure cible.",
  "weeks" : [
    {
      "goal" : "Poser les allures de travail individuelles via un test 5K en début de semaine. Long run 6 km facile. Introduire le renforcement préventif intermédiaire. Volume course total : ~17 km.",
      "sessions" : [
        {
          "cooldown" : "5 min marche lente + étirements statiques : ischio-jambiers 40 sec/côté, mollets 40 sec/côté, fléchisseurs de hanche 30 sec/côté, pyramidaux 30 sec/côté. Hydratation obligatoire post-test.",
          "day" : 1,
          "duration_minutes" : 55,
          "exercises" : [
            {
              "duration" : "5 km à effort contrôlé (pas sprint maximal)",
              "name" : "Test 5K chronométré",
              "notes" : "Effort 8/10 RPE, régulier du début à la fin. Note ton temps. Exemple : 30 min → allure 5K = 6:00 min/km. Ce temps détermine TOUTES tes allures du plan : allure seuil = allure 5K + 30-45 s/km (ex: 6:30-6:45 min/km) ; allure facile/long run = allure 5K + 90-120 s/km (ex: 7:30-8:00 min/km) ; allure 10K cible = allure 5K + 45-75 s/km (ex: 6:45-7:15 min/km). Adapter selon ton résultat réel.",
              "rest_seconds" : 0,
              "sets" : 1
            },
            {
              "duration" : "5 min marche",
              "name" : "Récupération après test",
              "rest_seconds" : 0,
              "sets" : 1
            },
            {
              "name" : "Single-leg calf raises (excentrique)",